<?xml version="1.0" encoding="UTF-8"?>
<configuration xmlns="http://www.ise.tu-berlin.de/AEC/Prototyping/Replication"
	xmlns:xsi="http://www.w3.org/2001/XMLSchema-instance"
	xsi:schemaLocation="Configuration.xsd ">


	<replicationpaths>
		<path start="nodeA">
			<link src="nodeA" type="sync" target="nodeB" />
			<link src="nodeB" type="sync" target="nodeC" />
			<link src="nodeC" type="sync" target="nodeD" />
		</path>
	</replicationpaths>

	<replicationnodes>
		<!-- Private ip of amazon e2c nodes that are mapped to internal ids... -->
		<node label="nodeA" location="EU_WEST_1" />
		<node label="nodeB" location="US_EAST_1" />
		<node label="nodeC" location="US_WEST_1" />
		<node label="nodeD" location="SA_EAST_1" />
	</replicationnodes>
</configuration>
