<?xml version="1.0" encoding="UTF-8"?>
<configuration xmlns="http://www.ise.tu-berlin.de/AEC/Prototyping/Replication"
	xmlns:xsi="http://www.w3.org/2001/XMLSchema-instance"
	xsi:schemaLocation="Configuration.xsd ">


	<replicationpaths>
		<path start="nodeA">
			<link src="nodeA" type="sync" target="nodeB" />
			<link src="nodeB" type="sync" target="nodeC" />
			<link src="nodeC" type="sync" target="nodeD" />
		</path>
	</replicationpaths>

	<replicationnodes>
		<!-- Private ip of amazon e2c nodes that are mapped to internal ids... -->
		<node label="nodeA" ipadress="localhost" port="7183"  webserverport="8081" />
		<node label="nodeB" ipadress="localhost" port="7281"  webserverport="8082" />
		<node label="nodeC" ipadress="localhost" port="7384"  webserverport="8083" />
		<node label="nodeD" ipadress="localhost" port="7484"  webserverport="8084" />
	</replicationnodes>
</configuration>

